{
  "$schema": "https://github.com/yaniv-golan/claude-cowork-runtime-contract-checker/schemas/v0.json",
  "spec_version": "0",
  "claude_app_version": "1.6259.1",
  "operon_core_version": "2.1.121",
  "extracted_at": "2026-05-09T14:00:00Z",
  "extracted_from": {
    "asar_path": "/Applications/Claude.app/Contents/Resources/app.asar",
    "sha256": "<bundle-hash>"
  },

  "subagent_tool_filter": {
    "_description": "All built-in tools pass through one filter function (`LW8` in v2.1.138 CLI bundle) parameterized by `{tools, isBuiltIn, isAsync, permissionMode}`. The function applies up to 5 layers in order: (1) MCP fast-path, (2) edit-tools-in-plan-mode, (3) drop set, (4) non-builtin extra drop set, (5) async-only allowlist. MCP tools (`name.startsWith('mcp__') || isMcp===true`) ALWAYS pass — they're never gated by the allowlists.",
    "filter_function": {
      "symbol_v2_1_138": "LW8",
      "symbol_v2_1_119": "gz8",
      "signature": "({tools, isBuiltIn, isAsync=false, permissionMode}) => Tool[]",
      "logic": [
        "if hG(tool) return true                     // MCP fast-path: name starts with 'mcp__' or isMcp===true",
        "if A1(tool, ExitPlanMode) && permissionMode==='plan' return true",
        "if drop_set.has(tool.name) return false",
        "if !isBuiltIn && non_builtin_drop_set.has(tool.name) return false",
        "if isAsync && !async_allowlist.has(tool.name): { fallback then return false }",
        "return true"
      ]
    },
    "drop_set": {
      "description": "Always dropped, regardless of dispatch mode. Includes EnterPlanMode/ExitPlanMode (plan-mode is gated separately), TaskOutput (parent-only), Agent (legacy alias), AskUserQuestion (interactive — no parent listening), WaitForMcpServers (init-time only).",
      "names": ["TaskOutput", "ExitPlanMode", "EnterPlanMode", "Agent", "AskUserQuestion", "WaitForMcpServers"],
      "symbol_v2_1_138": "$zH",
      "symbol_v2_1_119": "R3H"
    },
    "non_builtin_extra_drop_set": {
      "description": "Additional drops applied only when `isBuiltIn === false`. v2.1.138 ships `M58 = new Set([...$zH])` — same contents as drop_set; the separation exists to allow divergence in future versions.",
      "names": ["TaskOutput", "ExitPlanMode", "EnterPlanMode", "Agent", "AskUserQuestion", "WaitForMcpServers"],
      "symbol_v2_1_138": "M58"
    },
    "async_dispatch_allowlist": {
      "description": "When `isAsync=true`, ONLY these names pass (in addition to MCP tools and the plan-mode pass-through). Used for `/background`, `/bg`, `/fork` and other async dispatch paths.",
      "names": [
        "Read", "WebSearch", "TodoWrite", "Grep", "WebFetch", "Glob",
        "Bash", "PowerShell",
        "Edit", "Write", "NotebookEdit",
        "Skill", "StructuredOutput", "ToolSearch",
        "EnterWorktree", "ExitWorktree",
        "REPL", "Monitor", "TaskStop"
      ],
      "count": 19,
      "spread_member_v2_1_138": "$2 = [Vq=Bash, h9=PowerShell]",
      "spread_member_v2_1_119": "VW = [wq=Bash, D9=PowerShell]",
      "symbol_v2_1_138": "Ys_",
      "symbol_v2_1_119": "jQ_",
      "discrepancy_resolution": "Earlier internal docs (claude-code-internals L89 / gist 303b6213b7a33167b3f98b076a5f81ad) claimed 'the async filter strips Bash'. The empirical observation that Bash isn't in a Cowork sub-agent's tool list IS correct. The mechanism explanation IS NOT — `LW8`/`Ys_` does include Bash (via the `...$2 = [Bash, PowerShell]` spread). The actual gate is **`HOST_LOOP_EXCLUDED_BUILTIN_TOOLS`** (`jie` in the desktop bundle): Cowork excludes Bash, NotebookEdit, REPL, JavaScript, and WebFetch from registered built-in tools at the host-loop layer, BEFORE the sub-agent allowlist filter runs. Replacements are registered as MCP tools — `mcp__workspace__bash`, `mcp__workspace__web_fetch`. Empirically reconfirmed May 2026: an actual Cowork sub-agent reports `mcp__workspace__bash` as a *deferred* tool (loadable via ToolSearch), while built-in `Bash` is absent. A host-CLI (CCD-mode) probe DOES show Bash in async sub-agents — because CCD mode doesn't apply the host-loop tool exclusion. The spec must distinguish these two layers; see `host_loop_tool_substitution`."
    },
    "experimental_fallback_allowlist": {
      "description": "When the async filter would reject a tool but `experimentalAgentTeams` flag is enabled (`r9() && PW()`), additional tool names pass.",
      "names": ["TaskCreate", "TaskGet", "TaskList", "TaskUpdate", "SendMessage", "CronCreate", "CronDelete", "CronList"],
      "symbol_v2_1_138": "Up9",
      "symbol_v2_1_119": "lk9",
      "gate": "r9() && PW() — both must return truthy. Resolves to a feature-flag check; not enabled by default."
    },
    "fork_subagent_allowlist": {
      "description": "v2.1.138 introduces a separate, more restrictive allowlist `Fp9` for fork-style subagents (the implicit `kind:'fork'` agent). This is distinct from `Ys_` (async). Three empty spreads (`...[]`) suggest conditionally-populated members under feature flags not yet active.",
      "names": ["Agent", "TaskStop", "SendMessage", "StructuredOutput"],
      "count": 4,
      "conditional_spreads_count": 3,
      "symbol_v2_1_138": "Fp9",
      "introduced_in": "v2.1.138 (or earlier — needs back-trace)"
    },
    "sync_task_tool": {
      "description": "Sync Task-tool sub-agent dispatch is the same `LW8` filter with `isAsync=false`. The `Ys_` allowlist gate is skipped — only the drop_set and non_builtin_extra_drop_set apply. Sync sub-agents see effectively all built-in tools EXCEPT the 6 in the drop set, plus all MCP tools.",
      "effective_filter": "drop_set + non_builtin_extra_drop_set only; allowlist not applied",
      "behaviorally_excludes": ["TaskOutput", "ExitPlanMode", "EnterPlanMode", "Agent", "AskUserQuestion", "WaitForMcpServers"],
      "behaviorally_includes": "everything else from the master tool registry, plus all MCP tools"
    },
    "mcp_tools": {
      "always_pass": true,
      "predicate": "tool.name.startsWith('mcp__') || tool.isMcp === true",
      "predicate_function": "hG (v2.1.138), yJ (v2.1.119)"
    }
  },

  "host_loop_tool_substitution": {
    "_description": "Operates in the desktop bundle (`Claude.app/.../index.js`), not the CLI. When the desktop spawns a Cowork session, it filters its registered built-in tools through a host-loop-safe set BEFORE handing them to the SDK. Tools in `HOST_LOOP_EXCLUDED_BUILTIN_TOOLS` are dropped; the desktop's `workspace` MCP server registers replacements (`mcp__workspace__bash`, `mcp__workspace__web_fetch`). This is THE gate that makes `Bash` empirically unavailable to Cowork sub-agents, not the CLI's `LW8`/`Ys_` filter.",
    "scope": "Cowork mode only (Claude.app spawning `claude --cowork` inside microVM). CCD mode (host CLI without `--cowork`) does NOT apply this substitution — Bash is registered normally in CCD.",
    "vm_substrate_by_platform": {
      "macos": "Apple Hypervisor with bundled disk image (`Claude.app/Contents/Resources/smol-bin.{x64,arm64}.img`). VM lifecycle managed in-process by Claude.app.",
      "windows": "Hyper-V via separately-installed `CoworkVMService` (Windows service running `cowork-svc.exe`). Requires `vmcompute` and `HvHost` services. Service autostart has known reliability issues — see https://github.com/anthropics/claude-code/issues/56772 (and 48661, 48001, 55649).",
      "linux": "<not yet traced — likely KVM-based; check Linux build of Claude.app>"
    },
    "vm_failure_modes": {
      "windows_service_stopped": {
        "user_visible_error": "Workspace unavailable. The isolated Linux environment failed to start.",
        "actual_cause": "CoworkVMService stopped or failed to autostart.",
        "impact": "mcp__workspace__bash dies; file-op tools (Read/Write/Edit/Glob/Grep) and request_cowork_directory continue to work because they don't depend on the VM.",
        "manual_recovery": "Start-Service CoworkVMService (DACL allows interactive user; no elevation needed)."
      }
    },
    "host_loop_safe_set": {
      "_description": "Tools that survive host-loop filtering. PTi(tools) = tools.filter(t => t.startsWith('mcp__') || zvt.includes(t)). MCP tools always pass; built-ins must be in this set.",
      "names": ["Task", "Glob", "Grep", "Read", "Edit", "Write",
                "TodoWrite", "TaskCreate", "TaskUpdate", "TaskGet", "TaskList", "TaskStop",
                "WebSearch", "Skill", "AskUserQuestion", "ToolSearch", "SendUserMessage"],
      "symbol_v1_6259_1": "zvt",
      "filter_fn_symbol_v1_6259_1": "PTi"
    },
    "host_loop_excluded_builtins": {
      "_description": "Built-in tool names that the desktop EXPLICITLY EXCLUDES from registration in Cowork mode. These are the names the desktop bundle considers 'unsafe to run on the host loop'. Each gets an MCP replacement.",
      "names": ["Bash", "NotebookEdit", "REPL", "JavaScript", "WebFetch"],
      "symbol_v1_6259_1": "jie",
      "mcp_replacements": {
        "Bash": "mcp__workspace__bash",
        "WebFetch": "mcp__workspace__web_fetch",
        "_note_others": "NotebookEdit, REPL, JavaScript replacements not yet traced; likely served via the cowork artifact MCP server or absent in async sub-agents (these are interactive notebook/REPL tools — meaningful only in main-loop dispatch)."
      }
    },
    "renderer_dependent_extra_drops": {
      "_description": "Additional drops applied when the session is a 'Bridge' or 'Dispatch child' (i.e. async sub-agent dispatch). On top of host-loop exclusion.",
      "names": ["AskUserQuestion", "mcp__cowork-onboarding__show_onboarding_role_picker",
                "mcp__cowork__allow_cowork_file_delete", "mcp__cowork__present_files",
                "mcp__cowork__launch_code_session", "mcp__cowork__create_artifact",
                "mcp__cowork__update_artifact", "mcp__cowork__propose_skills"],
      "symbol_v1_6259_1": "Akt",